ID,Repo ID,Practices,Notes,Guidelines 1,Guidelines 2,Guidelines 3,Guidelines 4
66,ipa320/cob_command_tools,"Part of the freely available ROS components that run on the service robot is the driver framework ros_canopen. The stack is running under Linux, with or without linkage to ROS. It has been implemented in C++ and is divided into several layers (Figure 3) in order to enhance its flexibility and extensibility. The connection to the CAN network is enabled by SocketCAN, which is included in the mainline kernel and supports an increasing number of interface devices. Regarding the CANopen master implementation, the driver is auto- matically configured based on the EDS files for the slave devices. It supports most services like Network Management (NMT), Service Data Objects (SDO), Process Data Objects (PDO), Synchronization Objects (SYNC), Emergency Objects (EMCY), or Heartbeats. On top of it, a ROS interface was implemented that provides further configuration and intro- spection functionalities.",,G2,G4,G8,G25
67,ipa320/cob_command_tools,"it is fully integrated with another software framework, ros_control, which abstracts the controller interface from the actual hardware implementation.",,G2,,,
68,ipa320/srs_public,"Robotic Hardware Independence: SRS is not bond to one single platform; the software must be as robot hardware independent as possible. To archive this target, some software modules in the architecture need function as device drivers and thus are tied to hardware. The rest of modules should operate only on higher level hardware-independent abstractions. ",This is another reference to having a layered architecture.,G2,,,
69,ipa320/srs_public,"Parallel Processing: Applications involved in SRS requires considerable amount of computational resources for planning and control to sustain the local intelligence of the robot. At the same time, the SRS software has to satisfy long term learning and analysis requirement. Furthermore, it should also satisfy real-time constraints required by the real world applications. Generally, the onboard computational resources of the robot cannot support all the required computation, so separation the computational load across multiple sources e.g. off board machines is required.",,G9,,,
70,ipa320/srs_public,"Modularity and Collaborative Development: SRS project involves dozens of researchers and developers from different organisation, discipline and background. Since it targets to build large systems contributing to a sizable code base, it is of high importance to enforce modularity and interoperability between the software components and organise them in a systematic way allowing concurrent work on the system from all the partners in a fashion that components can be developed and verified separately and integrated efficiently in the future.",,G18,,,
71,ipa320/srs_public,"Cross Platform Communication: SRS communication requires transfer of data and commands between various hardware platforms, operating systems and applications. In order to achieve a versatile concept of robot communications it is very useful to build the SRS communications based on an efficient and reliable foundation. Furthermore, although most of robotic resources are available within Linux environment, some sensors and development kit come with only binary Windows drivers. Therefore, SRS software system must be able to deal with multiple operating system, and cross platform communication is required.",,G2,G3,G38,
72,ipa320/srs_public,"Integration with other Code Base: SRS intended to take the advantage of the latest progress of robotic development. It should be capable of re-use code available from other source. For example identified suitable candidates are the navigation system, and simulators from the Player project, vision algorithms from OpenCV, and planning algorithms from OpenRAVE, among many others. In each case, it should only to expose various configuration options and to route data into and out of the respective software, with as little wrapping or patching as possible",,G3,G4,,
73,ipab-slmc/exotica,Problem and task definitions are generic across solvers and can be loaded easily from configuration files as dynamic plug-ins without the need to recompile.,Take advantage of configuration files for things that may change between executions.,G3,G4,,
74,ipab-slmc/exotica,"To further support the extensibility of EXOTica, the motion solvers and the task maps are loaded into EXOTica as plug-ins.",Extensibility via plug-ins,G4,,,
75,irvs/ros_tms,"The ROS-TMS consists of 73 packages categorized into 11 groups and 151 processing nodes. Re-configuration of structures, for instance adding or removing modules such as sensors, actuators, and robots, is simple and straightforward owing to the high flexibility of the ROS architecture.",Take advantage of ROS modularity,G18,,,
76,jhu-dvrk/dvrk-ros,"In general, telerobotic software can be arranged into the following functional layers (see Fig. 5): hardware interface (I/O), low-level control (e.g., PID), high-level control, teleoperation, and application",Layered architecture,G39,,,
77,jhu-dvrk/dvrk-ros,"This layer also defines data structures for configuration parameters, such as sensor scale factors and the mapping of hardware to robot joints. Configuration file parsers can be created to populate these data structures from any defined format.",Configuration files for parameters,G2,G3,,
78,jhu-dvrk/dvrk-ros,"One challenge for such a component-based approach is data synchronization; this is especially true for servo loop control running at a high frequency of 1 kHz or greater. If a separate thread is created for each servo control loop and the I/O component, it is likely that the feedback data used in the servo loop control could be out of synchronization and potentially affect controller performance. As illustrated in Fig. 5, our solution puts the I/O component and all servo control (PID) components in one single thread, while keeping the advantage of a component-based approach.",Data synchronization,G9,,,
79,lagadic/vision_visp,Another consequence is that it is not necessary to modify the controller library when adding a new feature,,G4,,,
80,lagadic/vision_visp,"One of the challenges dealing with a visual servoing package is that it must deal with multiple robotic platforms as well as with various framegrabbers. Obviously, the package does not (and cannot) provide an interface with all possible robots and grabbers, but we built it in order to facilitate adding new hardware",,G2,G4,,
81,leggedrobotics/free_gait,"The implementation of Free Gait with the robot specific software is realized through adapters. An adapter is responsible to provide the actual state of the robot and forward the desired robot state to the robot controller. Through the adapter, the execution of the Free Gait commands is controlled with a free to choose sampling time ∆t.",,G5,G2,,
82,leggedrobotics/free_gait,"By separating the motion generation with the motion execution, Free Gait is robot platform agnostic, enabling to easily port motion generation methods and algorithms to a different robot. As Free Gait is also independent of the underlying whole body controller, implementing different control methods for the same control tasks requires only to write a new adapter without additional overhead. Furthermore, it is often useful to simulate or preview the motion plan, which can be accomplished by writing adapters for each and viewing the Free Gait commands before the execution on the real robot.",,G2,G18,,
83,mcgill-robotics/ros-interop,The interop client can also run in an offline mode which reads mission and obstacle information from a file instead of the server. This means that an internet connection is not required when operating in this mode.,,G29,,,
84,NiryoRobotics/niryo_one_ros,"This picture gives you an idea about the different layers of the application. Let’s start with the bottom (hardware). The hardware layer is, well, anything that directly deals with hardware ... Then we have the control layer ... On top of that, the motion planning layer is responsible for finding inverse kinematics and building a path for the robot ... The next layer is the commander layer ... On the top of this layer, we finally have the external/user layer.",Another instance of a layered architecture,G39,,,
85,NiryoRobotics/niryo_one_ros,"On the top of this layer [the ROS command level], we finally have the external/user layer. We have developed a set of high level interfaces between the ROS commander layer and the outside. The main 2 goals of those interfaces are : 1. hiding the ROS complexity for users who want to use high level commands, and 2. Providing a way to control the robot from a non-ROS environment (more on that later).",,G26,,,
86,OSLL/slam-constructor,The package provides the utility lslam2d_bag_runner to launch algorithms in the offline mode to process datasets in BAG format.,,G29,,,
87,osrf/capabilities,"Only run those capabilities that are required by currently running applications (e.g., to save power and/or processing)",Energy as a concern.,G6,,,
88,osrf/capabilities,The capability server provides a ROS API that is implemented using ROS messages and services with a ROS topic for event feedback.,Services for calling capabilities and topic for feedback.,NO_GUIDANCE,,,
89,osrf/capabilities,"There is also a Python “client” API that provides an easy-to-use Python interface for interacting with the capability server. Under the hood this client API uses the ROS API so that the client API can be used on a remote computer, which is different from the computer that the capability server is running on.",,G26,,,
90,osrf/capabilities,"The capabilities system goes one step further by not only defining the type of data being sent, but also over which named topics the data will be sent, effectively defining how the system components will be connected. ROS concepts other than topics are also covered by capability interfaces, including: services, actions, parameters, and dynamic parameters. By defining the required types and names for each of the ROS concepts, robot developers can set up their robot to send and receive data according to the interface, and app developers can depend on that interface’s being available when designing their applications.

This approach is analogous to how the Android mobile operating system allows Android apps to require and access ""capabilities"" provided by the mobile device.",,G18,,,
91,PX4/avoidance,"The local_planner requires less computational power but it doesn't compute optimal paths towards the goal since it doesn't store information about the already explored environment. An in-depth discussion on how it works can be found in this thesis. On the other hand, the global_planner is computationally more expensive since it builds a map of the environment. For the map to be good enough for navigation, accurate global position and heading are required. An in-depth discussion on how it works can be found in this thesis. The safe_landing_planner classifies the terrain underneath the vehicle based on the mean and standard deviation of the z coordinate of pointcloud points. The pointcloud from a downwards facing sensor is binned into a 2D grid based on the xy point coordinates. For each bin, the mean and standard deviation of z coordinate of the points are calculated and they are used to locate flat areas where it is safe to land.",,G9,,,
92,RoboJackets/igvc-software,Our path planning is split into global planning and local planning in order to efficiently generate paths that are locally feasible for Jessii but also globally accurate in a computationally efficient manner.,,G9,,,
93,RoboJackets/igvc-software,"given that we have a source of absolute position from the GPS and a relatively accurate accelerometer from the IMU, the Extended Kalman Filter (EKF) running in our localization module is able to compensate for a faulty IMU with accurate positions and accelerations.",Combine global and local planning/localization,G23,G21,,
94,robotics-in-concert/rocon_multimaster,"One of the main goals of the capabilities is to make writing robot agnostic ""apps"" easier. If a robot can declare that it implements the standardized interface for the navigation capability, then an app can rely on the ROS interface used to utilize that capability. Making it easier for app developers to work independently of the robot developers and making it easier to integrate onto new robots. This is analogous to the use of Messages in topics and services, and that has proven to be very effective at easing integration of disparate parts of the system. This package provides the capability_server ROS node which loads all capability spec files from packages on the ROS_PACKAGE_PATH and provides a ROS interface for querying and running those capabilities.",,G4,G18,G8,
95,robotics-in-concert/rocon_multimaster,"The gateway will be the public frontend for a ros master and is intended to act much like a gateway on a local area network controlling what is exposed and what is forwarded between the local ros master and the outside world (other ros systems). The intention is to generalise this kind of interface beyond tools that previously existed (foreign_relay, master_sync and fki_multimaster) and also make their configuration/usage as simple as possible. Goals
Gate_G01 : do not burden non-multimaster systems with unnecessary overhead
Gate_G02 : do not interface directly with foreign ros masters (put the gateway inbetween)
Gate_G03 : support all ros api types (topics, services and actions).
Gate_G04 : auto-discover other gateways (pre-configured, zeroconf or name server)
Gate_G05 : provide quality of network connection statistics between systems
Gate_G06 : control what ros api should be put on a public interface (simplicity and security)
Gate_G07 : support flipping of local ros api to a remote gateway (control what and where your share)
Gate_G08 : support pulling of publicly exposed remote ros api from a remote gateway (open sharing)
Gate_G09 : configure/manage the type of connections created between systems (unreliable, comporessed, ...)
Gate_G9 : peer to peer gateway interactions (true multimaster, not two multimaster)
Gate_G10 : access control to permit/block requests for flipping/pulling
Gate_G11 : decouple from higher level components such as the app_manager (re-usable building block).
Decisions
Gate_D01a : sit alongside, do not extend rosmaster itself
Gate_D01b : modular components called when necessary (discovery, sync, zeroconf, multicast)
Gate_D02 : adapter like interface that accepts/makes requests on one side and interacts with the ros master api on the other
Gate_D03 : leave concepts like bundling of ros api in capabilities (or similar) to higher level components
Gate_D04 : gateway discovery mechanisms should be optional and varied
By hand (yaml), centralised server (redis), zeroconf or multicast.
Gate_D05 : assume each gateway represents a single system interface that needs to be monitored, this makes it simpler and is typical for robots, even if there is multiple machines connected internally
Gate_D06a : default settings for a gateway should not expose anything.
Gate_D06b : convenience option to dump all local topics on the public interface.
Gate_D07a : gateways should have the option to block flip requests.
Gate_D07b : flip requests should have enough details for passing on to the ros master api.
Gate_D07c : convenience option to flip all local interfaces to a remote.
Gate_D07d : convenience option to flip all public interfaces to a remote.
Gate_D09a : specify transport type and hints at the system level (e.g. reliable/unreliable configuration via roslaunch).
Gate_D09b : more complete transport types (multi-language unreliable, compression etc).
Gate_D12 : do not make decisions about what to expose, where and how - gateways should be just a mechanism that can be controlled by policies dictated by higher level components.",,G1,G38,G5,G19
96,robotics-in-concert/rocon_multimaster,"Backed by a redis key-value store, a rocon hub provides a centralised place to store relevant information for multiple ros systems interacting over a LAN. It's most common use is to act as a kind of name server assisting ros subsystems to find each other",,G7,,,
97,ros-controls/ros_control,"The backbone of the framework is the Hardware Abstraction Layer, which serves as a bridge to different simulated and real robots. This abstraction is provided by the hardware_interface::RobotHW class; specific robot implementations have to inherit from this class. Instances of this class model hardware resources provided by the robot such as electric and hydraulic actuators and low-level sensors such as encoders and force/torque sensors. It also allows for integrating heterogeneous hardware or swapping out components transparently whether it is a real or simulated robot. [....] Through these typed interfaces this abstraction enables easy introspection, increased maintainability and controllers to be hardware-agnostic.",,G2,G16,,
98,ros-controls/ros_control,"The lifecycle of controllers is not static. It can be queried and modified at runtime through standard ROS services provided by the controller_manager. Such services allow to start, stop and configure controllers at runtime.","If we start finding a standard for nodes lifecycle, then we gain in terms of configurability, adaptability",G30,,,
99,ros-perception/opencv_apps,"With opencv_apps, you can run a lot of functionalities OpenCV provides in the simplest manner in ROS, i.e., running a launch file that corresponds to the functionality.","Generic package, the specific nodes to be run are declared in the launch file",G3,,,
100,ros-planning/navigation,"One costmap is used for global planning, meaning creating long-term plans over the entire environment, and the other is used for local planning and obstacle avoidance.",,G7,,,
101,ros-planning/navigation2,The reason for the change was to make it so that global and local planners would be Action Servers and could be replaced at launch or run time with other implementations providing the same Action.,,G4,G17,,
102,ros-planning/navigation2,All these changes make it possible to replace any of these nodes at launch/run time with any other algorithm that implements that same interface.,,G4,G17,,
103,ros-planning/navigation2,"In contrast to the ROS1 navigation map server, the nav2 map server will support a variety of map types, and thus some aspects of the original code have been refactored to support this new extensible framework. In particular, there is now a MapLoader abstract base class and type-specific map loaders which derive from this class. There is currently one such derived class, the OccGridLoader, which converts an input image to an OccupancyGrid and makes this available via topic and service interfaces. The MapServer class is a ROS2 node that uses the appropriate loader, based on an input parameter.",,G4,G3,,
104,ros-planning/navigation2,"Critics like to give things scores. Once we know we're not at the goal and have a bunch of candidate trajectories, we evaluate them based on a collections of TrajectoryCritics. Here's the life-cycle.",,G30,,,
105,ROS-PSE/arni,"Advanced ROS Network Introspection (ARNI) extends the /statistics features introduced with Indigo and completes the collected data with measurements about the hosts and nodes participating in the network. These are gathered from an extra node that has to run on each host machine. All statistics or metadata can be compared against a set of reference values using the monitoring_node. The rated statistics allow to run optional countermeasures when a deviation from the reference is detected, in order to remedy the fault or at least bring the system in a safe state.",,G25,G19,,
106,ros/actionlib,"The action client and server communicate with each other using a predefined action protocol. This action protocol relies on ROS topics in a specified ROS namespace in order to transport messages. In some cases, however, if the service takes a long time to execute, the user might want the ability to cancel the request during execution or get periodic feedback about how the request is progressing. The actionlib package provides tools to create servers that execute long-running goals that can be preempted. It also provides a client interface in order to send requests to the server.",Specify the protocol of the messages you expect,G31,,,
107,ros/geometry2,"A distributed system
Value: No bottleneck process and all processes are one step away for minimal latency.

Implementation: Everything is broadcast and reassembled at end consumer points. There can be multiple data sources for tf information. Data is not required to be synchronized by using interpolation. Data can arrive out of order.",,G5,G32,G23,
108,ros/geometry2,"Only transform data between coordinate frames at the time of use
Value: Efficiency, both computational, bandwidth, and simplicity.",,G33,,,
109,ros/geometry2,"Support queries on data which are timestamped at times other than the current time
Value: Handle data processing lag gracefully.

Implementation: Interface class stores all transform data in memory and traverses tree on request.",,G6,G20,,
110,ros/geometry2,"Only have to know the name of the coordinate frame to work with data
Value: Ease of use for users/developers.

Implementation: Use string frame_ids as unique identifiers.",,G34,,,
111,ros/geometry2,"The system doesn't need to know about the configuration before hand and can handle reconfiguring on the fly
Value: Generic system for any configuration.

Implementation: Use directed tree structure. It allows fast traversal(order n where n is the depth of the tree) when evaluating a transform. It can be reconfigured simply by redefining a link. It does not require any structure verification or maintenance of the data structure, except for maintaining a sorted linked list of data for each link.",,G9,,,
112,ros/geometry2,"Core is ROS agnostic
Value: Code reuse.

Implementation: Core library is C++ class. A second class provides ROS interface and instantiates the core library.",,G35,,,
113,ros/geometry2,"Thread Safe Interface
Values: Can be used in a multithreaded program.

Implementation: Mutexes around data storage for each frame. Mutexes around frame_id lookup map. Each are individually locked and unlocked, neither can block the other.",,G36,,,
114,ros/geometry2,"Multi-Robot Support
Values: Can be used with multiple robots with the same or similar configuration.

Implementation: Use a tf_prefix similar to a namespace for each robot.",,G34,,,
115,ros/geometry2,"Native Datatype Interfaces
Value: Users can interact with tf2_ros in their native datatypes, the conversion is handled implicitly by the library.

Implementation: There is a tf2::convert(A, B) templated method that converts from type A to type B using the geometry_msg types as the common factor.

And as long as any datatype provides the methods msgType toMsg(datatype) and fromMsg(msgType, datatype) it can be automatically converted to any other datatype with the same methods defined and a matching msgType.

All tf2_ros interfaces can then be called with native type in and native type out. Note, the native type in and out do not need to match.",,G17,,,
116,ros/geometry2,"tf messages do not deal with low bandwidth networks well
Within a single well connected network tf works fine, but as you transition to wireless and lossy networks with low bandwidth the tf messages start to take up a large fraction of the available bandwidth. This is partially due to the many to many nature and partially due to the fact that there is no way to choose the desired data rate for each consumer.
Solution: Add support for /tf_static topic which will only publish latched topics.",,G19,,,
117,ros/geometry2,"tf doesn't keep a long history
The default timescale for storage is 10 seconds which is fine for live operations, but storing anything longer than that requires storing the data in a known fixed frame such that it will be transformable later.
Solution: A long history can be kept in a specialized node and queried remotely.",,G37,,,
118,rosflight/rosflight,Sensor stream topics are only advertised if they are being transmitted by the autopilot.,,NO_GUIDANCE,,,
119,RoverRobotics/rr_openrover_basic,This means that if the robot gets unplugged and replugged in this value may change. It is recommended to setup a udev rule for the robot that will always name it something like /dev/rover and to set this parameter to the same thing so that if it gets unplugged and replugged in things will work still.,Use logical names,G34,,,
120,RoverRobotics/rr_openrover_basic,If enabled this driver will stop the robot if nothing new is published to cmd_vel/managed in the timeout window. Its highly recommended that this be set to true.,,G30,,,
121,spencer-project/spencer_people_tracking,Well-structured ROS message types and clearly defined interfaces make it easy to integrate custom detection and tracking components.,,G30,G31,G17,
122,spencer-project/spencer_people_tracking,"We highly encourage reuse of these messages to benefit from our rich infrastructure of detection, tracking, filtering and visualization components! Existing detection and tracking algorithms can often easily be integrated by publishing additional messages in our format, or by writing a simple C++ or Python node that converts between message formats.",,G17,G5,,
